<?xml version="1.0" encoding="ISO-8859-1"?>
<!DOCTYPE ccg-setinfo SYSTEM "../gccg-set.dtd">
<ccg-setinfo name="" game="Name of the Game">

  <cards>
    <card name="A Card" text="" graphics="cardback.jpg">
    </card>
    <card name="_unknown_" text="" graphics="">
    </card>
    <card name="_unknown_" text="" graphics="">
    </card>
    <card name="_unknown_" text="" graphics="">
    </card>
    <card name="_unknown_" text="" graphics="">
    </card>
    <card name="_unknown_" text="" graphics="">
    </card>
    <card name="_unknown_" text="" graphics="">
    </card>
    <card name="_unknown_" text="" graphics="">
    </card>
    <card name="_unknown_" text="" graphics="">
    </card>
    <card name="_unknown_" text="" graphics="">
    </card>
    <card name="_unknown_" text="" graphics="">
    </card>
    <card name="_unknown_" text="" graphics="">
    </card>
    <card name="_unknown_" text="" graphics="">
    </card>
    <card name="_unknown_" text="" graphics="">
    </card>
    <card name="_unknown_" text="" graphics="">
    </card>
    <card name="_unknown_" text="" graphics="">
    </card>
    <card name="_unknown_" text="" graphics="">
    </card>
    <card name="_unknown_" text="" graphics="">
    </card>
    <card name="_unknown_" text="" graphics="">
    </card>
    <card name="_unknown_" text="" graphics="">
    </card>
    <card name="_unknown_" text="" graphics="">
    </card>
    <card name="_unknown_" text="" graphics="">
    </card>
    <card name="_unknown_" text="" graphics="">
    </card>
    <card name="_unknown_" text="" graphics="">
    </card>
    <card name="_unknown_" text="" graphics="">
    </card>
    <card name="_unknown_" text="" graphics="">
    </card>
    <card name="_unknown_" text="" graphics="">
    </card>
    <card name="_unknown_" text="" graphics="">
    </card>
    <card name="_unknown_" text="" graphics="">
    </card>
    <card name="_unknown_" text="" graphics="">
    </card>
    <card name="_unknown_" text="" graphics="">
    </card>
    <card name="_unknown_" text="" graphics="">
    </card>
    <card name="_unknown_" text="" graphics="">
    </card>
    <card name="_unknown_" text="" graphics="">
    </card>
    <card name="_unknown_" text="" graphics="">
    </card>
    <card name="_unknown_" text="" graphics="">
    </card>
    <card name="_unknown_" text="" graphics="">
    </card>
    <card name="_unknown_" text="" graphics="">
    </card>
    <card name="_unknown_" text="" graphics="">
    </card>
    <card name="_unknown_" text="" graphics="">
    </card>
    <card name="_unknown_" text="" graphics="">
    </card>
    <card name="_unknown_" text="" graphics="">
    </card>
    <card name="_unknown_" text="" graphics="">
    </card>
    <card name="_unknown_" text="" graphics="">
    </card>
    <card name="_unknown_" text="" graphics="">
    </card>
    <card name="_unknown_" text="" graphics="">
    </card>
    <card name="_unknown_" text="" graphics="">
    </card>
    <card name="_unknown_" text="" graphics="">
    </card>
    <card name="_unknown_" text="" graphics="">
    </card>
    <card name="_unknown_" text="" graphics="">
    </card>
    <card name="_unknown_" text="" graphics="">
    </card>
    <card name="_unknown_" text="" graphics="">
    </card>
    <card name="_unknown_" text="" graphics="">
    </card>
    <card name="_unknown_" text="" graphics="">
    </card>
    <card name="_unknown_" text="" graphics="">
    </card>
    <card name="_unknown_" text="" graphics="">
    </card>
    <card name="_unknown_" text="" graphics="">
    </card>
    <card name="_unknown_" text="" graphics="">
    </card>
    <card name="_unknown_" text="" graphics="">
    </card>
    <card name="_unknown_" text="" graphics="">
    </card>
    <card name="_unknown_" text="" graphics="">
    </card>
    <card name="_unknown_" text="" graphics="">
    </card>
    <card name="_unknown_" text="" graphics="">
    </card>
    <card name="_unknown_" text="" graphics="">
    </card>
    <card name="_unknown_" text="" graphics="">
    </card>
    <card name="_unknown_" text="" graphics="">
    </card>
    <card name="_unknown_" text="" graphics="">
    </card>
    <card name="_unknown_" text="" graphics="">
    </card>
    <card name="_unknown_" text="" graphics="">
    </card>
    <card name="_unknown_" text="" graphics="">
    </card>
    <card name="_unknown_" text="" graphics="">
    </card>
    <card name="_unknown_" text="" graphics="">
    </card>
    <card name="_unknown_" text="" graphics="">
    </card>
    <card name="_unknown_" text="" graphics="">
    </card>
    <card name="_unknown_" text="" graphics="">
    </card>
    <card name="_unknown_" text="" graphics="">
    </card>
    <card name="_unknown_" text="" graphics="">
    </card>
    <card name="_unknown_" text="" graphics="">
    </card>
    <card name="_unknown_" text="" graphics="">
    </card>
    <card name="_unknown_" text="" graphics="">
    </card>
    <card name="_unknown_" text="" graphics="">
    </card>
    <card name="_unknown_" text="" graphics="">
    </card>
    <card name="_unknown_" text="" graphics="">
    </card>
    <card name="_unknown_" text="" graphics="">
    </card>
    <card name="_unknown_" text="" graphics="">
    </card>
    <card name="_unknown_" text="" graphics="">
    </card>
    <card name="_unknown_" text="" graphics="">
    </card>
    <card name="_unknown_" text="" graphics="">
    </card>
    <card name="_unknown_" text="" graphics="">
    </card>
    <card name="_unknown_" text="" graphics="">
    </card>
    <card name="_unknown_" text="" graphics="">
    </card>
    <card name="_unknown_" text="" graphics="">
    </card>
    <card name="_unknown_" text="" graphics="">
    </card>
    <card name="_unknown_" text="" graphics="">
    </card>
    <card name="_unknown_" text="" graphics="">
    </card>
    <card name="_unknown_" text="" graphics="">
    </card>
    <card name="_unknown_" text="" graphics="">
    </card>
    <card name="_unknown_" text="" graphics="">
    </card>
    <card name="_unknown_" text="" graphics="">
    </card>
    <card name="_unknown_" text="" graphics="">
    </card>
    <card name="_unknown_" text="" graphics="">
    </card>
  </cards>

</ccg-setinfo>
