<?xml version="1.0" encoding="ISO-8859-1"?>
<!DOCTYPE ccg-setinfo SYSTEM "../gccg-set.dtd">
<ccg-setinfo name="Firstborn Promo" dir="firstborn_promo" abbrev="FP" game="Middle-earth">
	<cards>
		<card name="Camthalion" graphics="Camthalion.jpg" text="Unique. Elf. 1 strike. +2 prowess against Elves.May be played keyed to any Dark-domain [d] or Dark-hold [D], if there is a Nazgul permanent-event or Ringwraith in play, or to any Shadow-hold [S] following a Nazgul attack. Cannot be targetted by spells or magic. As a short-event, playable on a hero character moving through a Dark-domain or to/from a Dark-hold. Character loses all his skills for the rest of the turn; discard any Knowledge or Information events he controls.">
			 <attr key="type" value="Hazard"/>
			 <attr key="rarity" value="P"/>
			 <attr key="unique" value="yes"/>
			 <attr key="class" value="Creature/Short-event"/>
			 <attr key="prowess" value="12/8"/>
			 <attr key="mp" value="2"/>
			 <attr key="strikes" value="1"/>
			 <attr key="subclass" value="Elves"/>
		</card>
		<card name="Ellindiel" graphics="Ellindiel.jpg" text="Unique. Noldo. Grey Agent. +2 EI against characters with a home site in Eriador. Discard if in company with an Elf or Dúnadan with a higher mind.Any Wisp of Pale Sheen may be played keyed to Ellindiel's current non-Free-hold [F] site.">
			 <attr key="type" value="Grey Agent Character"/>
			 <attr key="rarity" value="P"/>
			 <attr key="unique" value="yes"/>
			 <attr key="prowess" value="3/8"/>
			 <attr key="mind" value="7"/>
			 <attr key="influence" value="2"/>
			 <attr key="mp" value="2"/>
			 <attr key="home_site" value="Any site in Arthedain"/>
			 <attr key="agent" value="yes"/>
			 <attr key="subclass" value="Grey Agent"/>
			 <attr key="race" value="Elf"/>
			 <attr key="keyword" value="Grey Agent"/>
			 <attr key="keyword" value="Noldo"/>
		</card>
		<card name="Elves of Edhellond" graphics="Elves of Edhellond.jpg" text="Unique. Playable at Edhellond if the influence check is greater than 10.Standard Modifications: Elves (+2), Dúnedain (+1), character with home site Edhellond (+2). This faction is worth 2 mp if no manifestation of Eärcaraxë is in active play. If Círdor is at Edhellond, you may play Sail to the West as if at Grey Havens.">
			 <attr key="type" value="Hero Resource"/>
			 <attr key="rarity" value="P"/>
			 <attr key="unique" value="yes"/>
			 <attr key="class" value="Elf Faction"/>
			 <attr key="mp" value="1(2)"/>
		</card>
		<card name="Kheleglin" graphics="Kheleglin.jpg" text="Unique. Elf. Noldo. Playable at any Dark-hold [D], if you discard (for no effect) a Stolen Knowledge card from the company. Kheleglin comes into play wounded. tap: if at an Elf-hold and discard a (stored) Reforging from his company to search your discard pile or sideboard.for a Noldo Lantern, which may be placed with a character in the company.">
			 <attr key="type" value="Stage Resource"/>
			 <attr key="rarity" value="P"/>
			 <attr key="unique" value="yes"/>
			 <attr key="class" value="Sage Ally"/>
			 <attr key="prowess" value="3/9"/>
			 <attr key="mind" value="3"/>
			 <attr key="mp" value="2"/>
			 <attr key="keyword" value="Noldo"/>
		</card>
		<card name="Maranya" graphics="Maranya.jpg" text="Unique. Mind Ring. Playable on Celedhring at Barad-dûr(or in your starting company in lieu of a minor item). You may play Mithril and Vein of Arda as minion resources. Celedhring only: during site phase at a Shadow-hold [S] or Dark-hold [D] you may:tap: store and/or play Dark Forges as if at a Darkhaven [K].tap: place a Vein of Arda or Mithril in the company with an item in the company: it becomes a jewel and all of its bonusses are increased by 1.Celedhring makes a corruption check at -2.">
			 <attr key="type" value="Minion Resource"/>
			 <attr key="rarity" value="P"/>
			 <attr key="unique" value="yes"/>
			 <attr key="class" value="Special Item"/>
			 <attr key="mind" value="-1"/>
			 <attr key="influence" value="+1"/>
			 <attr key="cp" value="2"/>
			 <attr key="keyword" value="Mind Ring"/>
		</card>
	</cards>
</ccg-setinfo>